<?xml version="1.0" encoding="UTF-8"?>
<tupleModel xmlns="http://www.ibm.com/xmlns/prod/streams/spl/tuple"
                   xmlns:xsi="http://www.w3.org/2001/XMLSchema-instance"
                   xsi:schemaLocation="http://www.ibm.com/xmlns/prod/streams/spl/tuple tupleModel.xsd"
    class="myTupleClass" splType="tuple&lt;abc t1, def t2>" facade="false" equalitySupported="true" >
   <headers>
      <header>hisTupleClass.h</header>
      <header>herTupleClass.h</header>
   </headers>

   <attributes>
      <attribute>
         <name>t1</name>
         <cppType>hisTupleClass</cppType>
         <splType>tuple</splType>
         <fixedSize>20</fixedSize>
      </attribute>

      <attribute>
         <name>t2</name>
         <cppType>string</cppType>
         <splType>rstring</splType>
      </attribute>
   </attributes>

</tupleModel>
